{
  "schemaVersion": "1.0.0",
  "contentVersion": "1.1.1",
  "id": "slider",
  "name": "Slider",
  "category": "formularios",
  "summary": "Permite ajustar um valor dentro de um intervalo por meio de um controle deslizante.",
  "author": "Marcelo Sales",
  "language": "pt-BR",
  "path": "componentes/formularios/slider.html",
  "source": {
    "kind": "educational-guidance",
    "originalUrl": "https://www.accessboost.com.br/aulas/v1/exemplo-doc/exemplo-slider.html",
    "note": "Conteúdo migrado sem nova revisão normativa. Adaptações dependem do contexto; não constitui certificação de acessibilidade."
  },
  "sections": [
    {
      "id": "interaction-design",
      "title": "Design de interação",
      "panelId": "aba-interacao-conteudo",
      "blocks": [
        {
          "type": "text",
          "value": "\n            "
        },
        {
          "type": "element",
          "id": "slider.interaction-design.1",
          "tag": "h2",
          "attributes": {
            "class": "titulo-mobile"
          },
          "children": [
            {
              "type": "text",
              "value": "Design de Interação"
            }
          ]
        },
        {
          "type": "text",
          "value": "\n            "
        },
        {
          "type": "element",
          "id": "slider.interaction-design.2",
          "tag": "p",
          "attributes": {
            "class": "mt-3"
          },
          "children": [
            {
              "type": "text",
              "value": "\n              Questionamentos que devem ser feitos ao se projetar componentes\n              interativos do tipo "
            },
            {
              "type": "element",
              "id": "slider.interaction-design.3",
              "tag": "span",
              "attributes": {
                "class": "destaque"
              },
              "children": [
                {
                  "type": "text",
                  "value": "Slider"
                }
              ]
            },
            {
              "type": "text",
              "value": ".\n            "
            }
          ]
        },
        {
          "type": "text",
          "value": "\n            "
        },
        {
          "type": "element",
          "id": "slider.interaction-design.4",
          "tag": "p",
          "attributes": {},
          "children": [
            {
              "type": "text",
              "value": "\n              "
            },
            {
              "type": "element",
              "id": "slider.interaction-design.5",
              "tag": "strong",
              "attributes": {},
              "children": [
                {
                  "type": "text",
                  "value": "Importante:"
                }
              ]
            },
            {
              "type": "element",
              "id": "slider.interaction-design.6",
              "tag": "br",
              "attributes": {},
              "children": []
            },
            {
              "type": "text",
              "value": "Dependendo do contexto de\n              construção de seus respectivos componentes, é possível que haja\n              mais questionamentos, bem como alguns dos apresentados aqui não\n              ser necessários. A avaliação precisa ser feita caso a caso.\n            "
            }
          ]
        },
        {
          "type": "text",
          "value": "\n\n            "
        },
        {
          "type": "element",
          "id": "slider.interaction-design.7",
          "tag": "h3",
          "attributes": {
            "class": "destaque mt-4"
          },
          "children": [
            {
              "type": "text",
              "value": "Projetando para a \"não interação\""
            }
          ]
        },
        {
          "type": "text",
          "value": "\n            "
        },
        {
          "type": "element",
          "id": "slider.interaction-design.8",
          "tag": "ol",
          "attributes": {
            "class": "lista-detalhe link-padrao"
          },
          "children": [
            {
              "type": "text",
              "value": "\n              "
            },
            {
              "type": "element",
              "id": "slider.interaction-design.9",
              "tag": "li",
              "attributes": {},
              "children": [
                {
                  "type": "text",
                  "value": "\n                Antes de interagir é possível perceber o intervalo disponível e\n                o valor atual?\n              "
                }
              ]
            },
            {
              "type": "text",
              "value": "\n              "
            },
            {
              "type": "element",
              "id": "slider.interaction-design.10",
              "tag": "li",
              "attributes": {},
              "children": [
                {
                  "type": "text",
                  "value": "\n                A unidade do valor, quando existir, está visível e\n                compreensível?\n              "
                }
              ]
            },
            {
              "type": "text",
              "value": "\n              "
            },
            {
              "type": "element",
              "id": "slider.interaction-design.11",
              "tag": "li",
              "attributes": {},
              "children": [
                {
                  "type": "text",
                  "value": "\n                Valores mínimo, máximo e passos importantes são perceptíveis?\n              "
                }
              ]
            },
            {
              "type": "text",
              "value": "\n            "
            }
          ]
        },
        {
          "type": "text",
          "value": "\n\n            "
        },
        {
          "type": "element",
          "id": "slider.interaction-design.12",
          "tag": "h3",
          "attributes": {
            "class": "destaque mt-4"
          },
          "children": [
            {
              "type": "text",
              "value": "\n              Projetando para uso com mouse\n              "
            },
            {
              "type": "element",
              "id": "slider.interaction-design.13",
              "tag": "small",
              "attributes": {},
              "children": [
                {
                  "type": "text",
                  "value": "(qualquer dispositivo de apontamento)"
                }
              ]
            },
            {
              "type": "text",
              "value": "\n            "
            }
          ]
        },
        {
          "type": "text",
          "value": "\n            "
        },
        {
          "type": "element",
          "id": "slider.interaction-design.14",
          "tag": "ol",
          "attributes": {
            "class": "lista-detalhe link-padrao"
          },
          "children": [
            {
              "type": "text",
              "value": "\n              "
            },
            {
              "type": "element",
              "id": "slider.interaction-design.15",
              "tag": "li",
              "attributes": {},
              "children": [
                {
                  "type": "text",
                  "value": "\n                Há feedback visual ao passar o mouse ou arrastar o controle?\n              "
                }
              ]
            },
            {
              "type": "text",
              "value": "\n              "
            },
            {
              "type": "element",
              "id": "slider.interaction-design.16",
              "tag": "li",
              "attributes": {},
              "children": [
                {
                  "type": "text",
                  "value": "\n                Ao arrastar o marcador, o valor é atualizado de forma\n                perceptível?\n              "
                }
              ]
            },
            {
              "type": "text",
              "value": "\n              "
            },
            {
              "type": "element",
              "id": "slider.interaction-design.17",
              "tag": "li",
              "attributes": {},
              "children": [
                {
                  "type": "text",
                  "value": "\n                É possível selecionar valores com precisão suficiente para a\n                tarefa?\n              "
                }
              ]
            },
            {
              "type": "text",
              "value": "\n            "
            }
          ]
        },
        {
          "type": "text",
          "value": "\n\n            "
        },
        {
          "type": "element",
          "id": "slider.interaction-design.18",
          "tag": "h3",
          "attributes": {
            "class": "destaque mt-4"
          },
          "children": [
            {
              "type": "text",
              "value": "Projetando para uso com gestos"
            }
          ]
        },
        {
          "type": "text",
          "value": "\n            "
        },
        {
          "type": "element",
          "id": "slider.interaction-design.19",
          "tag": "ol",
          "attributes": {
            "class": "lista-detalhe link-padrao"
          },
          "children": [
            {
              "type": "text",
              "value": "\n              "
            },
            {
              "type": "element",
              "id": "slider.interaction-design.20",
              "tag": "li",
              "attributes": {},
              "children": [
                {
                  "type": "text",
                  "value": "O marcador possui área de toque confortável?"
                }
              ]